# [Real Time with Bill Maher](https://podcastindex.org/podcast/742515)

I saw this show on Family Guy, and I haven't looked away from it since.

# Next

* [Real Time: 8/23/2025](../../../2025/09/30/real-time-2025-08-23.md)
* [Real Time: 9/6/2025](../../../2025/09/25/real-time-2025-09-06.md)
* [Real Time: 9/9/2025](../../../2025/09/25/real-time-2025-09-09.md)
* [Real Time: 9/20/2025](../../../2025/09/24/real-time-2025-09-20.md)
* [Real Time: 9/27/2025](../../../2025/09/28/real-time-2025-09-27.md)
* [Real Time: 10/4/2025](../../../2025/10/17/real-time-2025-10-04.md)
* [Real Time: 10/7/2025](../../../2025/10/16/real-time-2025-10-07.md)
* [Real Time: 10/18/2025](../../../2025/10/21/real-time-2025-10-18.md)
* [Real Time: 10/25/2025](../../../2025/11/01/real-time-2025-10-25.md)
* [Real Time: 11/8/2025](../../../2025/11/17/real-time-2025-11-08.md)
* [Real Time: 11/15/2025](../../../2025/11/16/real-time-2025-11-15.md)
* [Club Random: Michael Rapaport](../../../2025/12/07/club-random-michael-rapaport.md)
