# [Pivot](https://podcastindex.org/podcast/174725)

Long ago, I saw a viral video of a [comedienne] storming out of an interview. Then, I saw [another interview] that she stormed out of, in another viral video. The comedienne was Joan Rivers. She soon became an obsession of mine. I watched everything she was in, including the [Comedy Central Roast of Joan Rivers], which was hosted by another comedienne, Kathy Griffin. She, too, became an obsession of mine. Having gone through everything with Joan Rivers, I then turned my attention to finding and watching everything with Kathy Griffin. This included the 8/2/2022 episode of the [Pivot] podcast, which Kathy Griffin co-hosted with Kara Swisher. I listened to many episodes of Pivot since then.

[comedienne]: https://www.youtube.com/watch?v=6lKS-Et-VmE
[another interview]: https://www.chron.com/culture/main/article/joan-rivers-swears-at-morning-show-host-during-1745331.php
[Comedy Central Roast of Joan Rivers]: https://www.imdb.com/title/tt1413788/
[Pivot]: https://podcastindex.org/podcast/174725

# Next

* [On with Kara Swisher](../../../2025/11/02/on-with-kara-swisher.md)
* [Pivot: 8/8/2025. Mel Robbins](../../../2025/10/14/pivot-2025-08-08-mel-robbins.md)
* [Pivot: 8/12/2025. David Remnick](../../../2025/09/23/pivot-2025-08-12.md)
* [Pivot: 8/19/2025. Abby Phillip](../../../2025/09/24/pivot-2025-08-19.md)
* [Pivot: 9/9/2025](../../../2025/09/24/pivot-2025-09-09.md)
* [Pivot: 9/12/2025](../../../2025/09/23/pivot-2025-09-12.md)
* [Pivot: 9/16/2025](../../../2025/09/23/pivot-2025-09-16.md)
* [Pivot: 9/23/2025](../../../2025/09/25/pivot-2025-09-23.md)
* [Pivot: 9/26/2025](../../../2025/09/27/pivot-2025-09-26.md)
* [Pivot: 9/30/2025](../../../2025/09/30/pivot-2025-09-30.md)
* [Pivot: 10/3/2025](../../../2025/10/15/pivot-2025-10-03.md)
* [Pivot: 10/7/2025](../../../2025/10/15/pivot-2025-10-07.md)
* [Pivot: 10/10/2025](../../../2025/10/15/pivot-2025-10-10.md)
* [Pivot: 10/21/2025](../../../2025/10/23/pivot-2025-10-21.md)
* [Pivot: 11/4/2025](../../../2025/11/13/pivot-2025-11-04.md)
* [Pivot: 11/12/2025](../../../2025/11/16/pivot-2025-11-12.md)
* [Pivot: 11/17/2025](../../../2025/11/26/pivot-2025-11-17.md)
* [Pivot: 11/18/2025](../../../2025/12/06/pivot-2025-11-18.md)
* [Pivot: 11/21/2025](../../../2025/11/28/pivot-2025-11-21.md)
* [Pivot: 11/25/2025](../../../2025/12/07/pivot-2025-11-25.md)
* [Pivot: 12/2/2025](../../../2025/12/11/pivot-2025-12-02.md)
* [Pivot: 12/5/2025](../../../2025/12/20/pivot-2025-12-05.md)
* [Pivot: 12/9/2025](../../../2025/12/13/pivot-2025-12-09.md)
* [Pivot: 12/12/2025](../../../2025/12/19/pivot-2025-12-12.md)
* [Pivot: 12/19/2025](../../../2025/12/28/pivot-2025-12-19.md)
